symbol,company,sector,industry,mcap,pe_ttm,pe_fwd,pb,peg,roe_pct,pm_pct,gm_pct,om_pct,de_ratio,debt,cash,rev_growth_pct,earn_growth_pct,rev_per_share,eps_ttm,div_yield_pct,summary,error
SBCL.NS,Shivalik Bimetal Controls Limited,Industrials,Metal Fabrication,43033214976.0,44.840935,29.882,8.904264,,21.614,16.792,45.209998,19.564,14.779,711360000.0,1046953984.0,22.8,24.0,99.095,16.66,55.00000000000001,"Shivalik Bimetal Controls Limited operates as a process and product engineering company in India, the United States, Europe, and internationally. The company manufactures thermostatic bimetals, parts/strips, SMDS/shunt resistors, reflow solder/pre solder products, strips, precision stainless steel products, thermostatic bimetals, coils and springs, and snap action discs. Its products are primarily used in switchgears, circuit breakers, protective relays, metering, automotive devices, energy and battery management devices, and various other electrical and electronic devices. The company serves electronics, automotive, domestic appliances, industrial, medical, defense, and agriculture and animal husbandry appliances sectors. The company was incorporated in 1984 and is headquartered in New Delhi, India.",
TEXRAIL.NS,Texmaco Rail & Engineering Limited,Industrials,Railroads,47354966016.0,24.04752,15.314474,1.6212113,,7.3850006,4.458,16.56,7.967999600000001,37.094,8947088384.0,4291040000.0,-13.3,43.2,108.564,4.84,64.0,"Texmaco Rail & Engineering Limited manufactures, sells, and provides services for rail and rail related products in India and internationally. It operates through three segments: Heavy Engineering, Steel Foundry, and Rail EPC. The company offers freight cars, such as railway freight cars, loco components and shells, and steel castings; steel girders for railway bridges; and pressure vessels. It also undertakes EPC contracts for execution of railway track, and signaling and telecommunication projects; rail electrification and automatic fare collection; hydro-mechanical equipment. In addition, the company provides wagons, parcel vans, brake vans, as well as components for fabricated bogie; front end; fuel tank; car body shell; platform sub assemblies; bogie and base frame; and end, side, bolster, floor, and ballast assembly. The company was founded in 1939 and is based in Kolkata, India.",
TRIVENI.NS,Triveni Engineering & Industries Limited,Consumer Defensive,Confectioners,101895856128.0,37.870598,22.482979,3.0477195,,8.2650006,4.2719997,27.154,15.97,64.646,21610100736.0,703400000.0,-7.3999999999999995,-11.1,285.367,12.21,114.99999999999999,"Triveni Engineering & Industries Limited engages in the sugar and allied businesses, and engineering businesses in India and internationally. The company is involved in the production of refined sugar, multi-grade white crystal sugar, and pharmaceutical-grade sugar; power generation using captively produced bagasse; production of alcohol/ethanol using molasses; operation of distilleries; and production of ethanol, extra neutral alcohol, and potable liquor. It also engages in the manufacture of low-speed gears and gear boxes covering supply to OEMs, after-market services, and retrofitment of gearboxes; EPC contracts, equipment supply, and operations and maintenance contracts; operation of fuel stations; and retail of diesel/petrol. In addition, the company provides engineered-to-order process equipment and comprehensive solutions; propulsion and other critical gearboxes, critical turbo and motor driven pumps, gas turbine generators for auxiliary power, fin stabilizers, propulsion shafting, winches, and engineered solutions; water treatment, water and wastewater network management, wastewater/sewage treatment, desalination for seawater and brackish water, recycle and zero liquid discharge services; and operation and maintenance contracts, products and process audits, health check-ups, upgradation of existing plants, and on-site support, as well as spares and services. It serves industrial clusters, refineries, coal, sand processing plant, non-ferrous industries, oil and gas, thermal and hydro power plants, steel plants, sugar and allied industries, and desalination industries. Triveni Engineering & Industries Limited was incorporated in 1932 and is headquartered in Noida, India.",
WELSPUNLIV.NS,Welspun Living Limited,Consumer Cyclical,Textile Manufacturing,156439920640.0,77.64953,17.803934,3.4375968,,4.301,2.175,46.238,5.9959996,46.501,23147900928.0,10245999616.0,-8.0,-22.1,105.283,2.14,6.0,"Welspun Living Limited manufactures and sells home textile products in India and internationally. It operates through two segments, Home Textiles and Flooring. The company offers bedding solutions, including utility and fashion bedding, and bed sheet products; and spunlace, needle punch, and wet wipes. It also provides bath solutions, such as towels, bathrobes, and bathroom rugs, as well as mats, area rugs, and carpets. In addition, the company offers flooring products comprising SPC, and grass tiles, and wall to wall carpets, as well as rugs and artificial grass. Further, it is involved in power generation; home textile product trading; and real estate business. It offers its products under the owned and licensed brands, such as Christy, Spaces, Welspun, Welspun Flooring, SPUN, Welhome, and Martha Stewart. The company was formerly known as Welspun India Limited and changed its name to Welspun Living Limited in September 2023. Welspun Living Limited was incorporated in 1985 and is headquartered in Mumbai, India. Welspun Living Limited is a subsidiary of Welspun Group Master Trust.",
ZENTEC.NS,Zen Technologies Limited,Industrials,Aerospace & Defense,169119596544.0,87.70522,35.899197,9.40948,,11.828,28.131,69.34700000000001,25.354,0.95,185174000.0,3547316992.0,-45.2,-68.8,76.487,21.44,6.0,"Zen Technologies Limited, together with its subsidiaries, engages in the design, development, manufacture, and sale of training simulators in India and internationally. The company provides anti-drone systems; training and simulation live ranges, comprising smart and multi-functional target systems, tank targets, master control station for live-firing ranges, air-to-ground firing range scoring system, containerized tubular and indoor shooting range, shoot house for live and simulated indoor tactical training, special purpose adapter for hand guns, cornershot weapon system, tank zeroing system, and containerized small arms firing range; armour combat training, indoor tracking, hand grenade simulator, and tactical engagement simulation systems; advanced weapon, medium machine gun, automatic grenade launcher, mortar integrated and carrier mortar tracked integrated, anti-tank guided missile, combat and infantry weapons training, artillery forward observers, integrated air defence, UAV mission, rotary wing, infantry combat vehicle driving, crew gunnery, gunnery, driving, BMP II integrated missile, driving training, automated driving, and bus and tatra driving simulators; and driving aptitude testing system. It serves police, paramilitary, armed, and security forces; government departments comprising transport, mining, and infrastructure; and the civilian markets. Zen Technologies Limited was incorporated in 1993 and is headquartered in Hyderabad, India.",
INDIAGLYCO.NS,India Glycols Limited,Basic Materials,Chemicals,71567826944.0,23.25746,,2.4400249,,11.2849995,6.952000399999999,27.281,12.83,57.645,16906099712.0,498300000.0,13.100000000000001,31.900000000000002,661.0,45.91,117.0,"India Glycols Limited, a green petrochemical company, manufactures and sells industrial chemicals in India. It operates through Bio-based Specialities and Performance Chemicals, Potable Spirits, and Ennature Biopharma segments. The company offers bio mono ethylene, di ethylene, and tri ethylene glycols; ethyl/butyl glycol ethers and acetates, and brake fluids; bio-polymers comprising guar and natural gums; biofuels; specialty chemicals, such as plasticisers, oil fields chemicals, bio-amines, methyl soyate, MDEA and MDEA derivatives, bio-potash granules, and C-Smart specialty products; molasses and grain based extra neutral alcohol; and specialty gases, including industrial and medical oxygen, food grade and industrial carbon dioxide, liquid argon and nitrogen, ethylene oxide, and bio ethylene oxide. It also provides Indian made foreign liquor, such as whiskey under Soulmate Blu and Single Reserve brands; vodka under Amazing brand; and rum under Zumba and Beach House XXX brands, as well as economy spirits under Bunty brand, and branded country liquor. In addition, the company offers natural active pharmaceutical ingredients, nutraceuticals, standardized botanical extracts, and nicotine derivatives. Further, its products find applications in pharma and healthcare; textiles; automotive; personal care; industrial and manufacturing; paints and coatings; oil and gas; food ingredients; packaging; potable spirits; and other various industries. The company also exports its products. The company was formerly known as UP Glycols Limited and changed its name to India Glycols Limited in August 1986. India Glycols Limited was incorporated in 1983 and is headquartered in Noida, India.",
